{
  "schemaVersion": 1,
  "id": "SCR-SVC-DRINK-BG-WORKSPACE-DRINK-R2-FINAL",
  "screenUnit": "SCR-SVC-DRINK",
  "status": "approved-by-user",
  "assets": [
    "BG-WORKSPACE-DRINK"
  ],
  "recomposition": {
    "file": "recomposition-report.json",
    "sha256": "0c68c52a4978a102ba6b9afdd239874df2e6020173afd9bd0771cafcac1d8186"
  },
  "optimizations": [
    {
      "file": "optimization-report.json",
      "sha256": "c241a8fa7dd1d02768d71368352cf582076614d795bc86547d929b0d16f40a2b"
    }
  ],
  "userDecision": {
    "date": "2026-07-30",
    "basis": "사용자가 BG-WORKSPACE-DRINK R2의 FHD/720 소비 화면을 최종 승인했다. R2 asset a30b…afce, FHD c6f2…789c, 720 fbc5…b87e를 대상으로 좌우 실내 연속면·외부 개구부 없음·body=0·raster UI=0·station=0 및 harness DOM 비포함을 확정했다."
  }
}
