{"schemaVersion":1,"id":"D1-ORDER-001-ALL-WAITING-FINAL","screenUnit":"SCR-SVC-CUSTOMERS","status":"approved-by-user","assets":["ARTIST-010-BACKGROUND-COMPLETE","BG-SERVICE-TABLE-ARTIST009","D1-TSUKIOKA-WAITING","UI-CUSTOMER-ORDER-WAIT-PANEL","UI-CUSTOMER-ORDER-ICON-NEGIMA","UI-CUSTOMER-ORDER-ICON-DRAFT-BEER"],"recomposition":{"file":"../all-waiting/r1/metadata/recomposition-report.json","sha256":"ef05af2fee3c88e3b6cd929954a9a46a90ab9888c77db94c4aec863c3a4e6289"},"optimizations":[{"file":"../../../../artist-010/complete-layers/background/r3/metadata/optimization-report.json","sha256":"0ca1f8a299d72c5eb7e9dfa0029abbc09cac2a9d7a3958e25a571a46e1ea73c8"},{"file":"../../complete-layers/table/r1/metadata/optimization-report.json","sha256":"3783c4b4da29bb70c1813c04de3595ea903b76ed213b18e8c7cf19f1c9eccc6d"},{"file":"../../complete-layers/d1-tsukioka/waiting/r2/metadata/optimization-report.json","sha256":"264858d99df0f733b956b149f5c58503a90102e01b389631a2408cf274b55634"},{"file":"../../../../artist-010/customer-ui/r2/wait-timer/r3/metadata/optimization-report.json","sha256":"987f6b01b3dba06c8c704ed60dec69759203d43b3aa00b628f07a4942b57325b"},{"file":"../../../../artist-010/customer-ui/r2/order-icons/negima/r1/metadata/optimization-report.json","sha256":"7c41247e1fc97b29be2d5e17c7f5cff9985b4f8b7e82a3e8e5f4259ae92bda08"},{"file":"../../../../artist-010/customer-ui/r2/order-icons/draft-beer/r1/metadata/optimization-report.json","sha256":"6d18e898e3fee43542664ee4308270bbc20a6317460bbf1c5f7f64978952908f"}],"userDecision":{"date":"2026-07-28","basis":"사용자가 D1 소비 화면 세 상태를 화면 단위로 최종 승인했다."}}
