{"schemaVersion":1,"id":"D1-ORDER-001-RECEIVED-EATING-FINAL","screenUnit":"SCR-SVC-CUSTOMERS","status":"approved-by-user","assets":["ARTIST-010-BACKGROUND-COMPLETE","BG-SERVICE-TABLE-ARTIST009","D1-TSUKIOKA-RECEIVED-EATING","UI-CUSTOMER-ORDER-WAIT-PANEL"],"recomposition":{"file":"../received-eating/r2/metadata/recomposition-report.json","sha256":"386a081b3e3e50416f9618d86cbf71874687b624211058c75bbda14f95364d67"},"optimizations":[{"file":"../../../../artist-010/complete-layers/background/r3/metadata/optimization-report.json","sha256":"0ca1f8a299d72c5eb7e9dfa0029abbc09cac2a9d7a3958e25a571a46e1ea73c8"},{"file":"../../complete-layers/table/r1/metadata/optimization-report.json","sha256":"3783c4b4da29bb70c1813c04de3595ea903b76ed213b18e8c7cf19f1c9eccc6d"},{"file":"../../complete-layers/d1-tsukioka/received-eating/r1/metadata/optimization-report.json","sha256":"bab36b3f47ea87ce8a48006818b724f85eaa928c0920c2a9cfdd315dba846ba1"},{"file":"../../../../artist-010/customer-ui/r2/wait-timer/r3/metadata/optimization-report.json","sha256":"987f6b01b3dba06c8c704ed60dec69759203d43b3aa00b628f07a4942b57325b"}],"userDecision":{"date":"2026-07-28","basis":"사용자가 D1 소비 화면 세 상태를 화면 단위로 최종 승인했다."}}
